Line,Strat Time,End Time
"Long before the birth of light,there was darkness.","00:00:34,034 "," 00:00:38,621"
And from that darknesscame the Dark Elves.,"00:00:38,789 "," 00:00:42,834"
"Millennia ago,the most ruthless of their kind, Malekith","00:00:44,712 "," 00:00:48,423"
sought to transform our universeback into one of eternal night.,"00:00:48,590 "," 00:00:53,428"
"Such evil was possiblethrough the power of the Aether,","00:00:55,889 "," 00:01:00,601"
an ancient force of infinite destruction.,"00:01:00,811 "," 00:01:04,480"
Malekith.,"00:01:07,651 "," 00:01:08,776"
Asgard's forces are upon us.,"00:01:08,944 "," 00:01:10,653"
"The noble armies of Asgard,led by my father, King Bor,","00:01:19,079 "," 00:01:23,374"
waged a mighty waragainst these creatures.,"00:01:23,500 "," 00:01:26,419"
Send in the Kursed!,"00:01:37,389 "," 00:01:39,682"
"As the Nine Worldsconverged above him,","00:01:56,492 "," 00:01:59,285"
Malekith could at lastunleash the Aether.,"00:01:59,369 "," 00:02:03,831"
Ahh!,"00:02:18,055 "," 00:02:19,138"
But Asgard rippedthe weapon from his grasp.,"00:02:21,975 "," 00:02:25,228"
"Without it, the Dark Elves fell.","00:02:26,271 "," 00:02:28,439"
"With the battle all but lost,","00:02:43,330 "," 00:02:44,914"
Malekith sacrificed his own people,"00:02:45,207 "," 00:02:47,583"
in a desperate attemptto lay waste to Asgard's army.,"00:02:48,418 "," 00:02:52,463"
Their deaths will mean our survival.,"00:02:55,300 "," 00:02:57,635"
This war is far from over.,"00:02:59,096 "," 00:03:01,097"
"Malekith was vanquished,and the Aether was no more.","00:03:08,730 "," 00:03:14,318"
Or so we were led to believe.,"00:03:15,362 "," 00:03:17,238"
"Sire, the Aether. Shall we destroy it?","00:03:18,699 "," 00:03:22,034"
If only we could.,"00:03:22,703 "," 00:03:25,079"
But its power is too great.,"00:03:25,247 "," 00:03:27,081"
Bury it deep.,"00:03:27,791 "," 00:03:30,167"
Somewhere no one will ever find it.,"00:03:30,544 "," 00:03:32,712"
Loki.,"00:04:14,504 "," 00:04:15,546"
"Hello, Mother.","00:04:16,048 "," 00:04:17,256"
Have I made you proud?,"00:04:18,091 "," 00:04:19,634"
"Please, don't make this worse.","00:04:19,801 "," 00:04:22,178"
Define worse.,"00:04:22,512 "," 00:04:24,096"
Enough!,"00:04:24,264 "," 00:04:25,848"
I will speak to the prisoner alone.,"00:04:26,016 "," 00:04:28,309"
I really don't seewhat all the fuss is about.,"00:04:42,366 "," 00:04:44,700"
Do you not truly feelthe gravity of your crimes?,"00:04:44,868 "," 00:04:48,245"
"Wherever you go, there is war, ruin,","00:04:48,372 "," 00:04:51,207"
and death.,"00:04:51,875 "," 00:04:53,376"
I went down to Midgard to rule thepeople of Earth as a benevolent god.,"00:04:53,543 "," 00:04:57,755"
Just like you.,"00:04:58,632 "," 00:05:00,091"
"We are not gods.We are born, we live, we die.","00:05:00,425 "," 00:05:04,053"
Just as humans do.,"00:05:04,429 "," 00:05:06,597"
"Give or take 5,000 years.","00:05:07,557 "," 00:05:09,934"
All this because Loki desires a throne.,"00:05:10,102 "," 00:05:13,854"
It is my birthright.,"00:05:14,022 "," 00:05:15,356"
Your birthright was to die,"00:05:15,524 "," 00:05:18,859"
as a child.,"00:05:19,361 "," 00:05:20,903"
Cast out onto a frozen rock.,"00:05:22,030 "," 00:05:24,490"
"If I had not taken you in,","00:05:26,410 "," 00:05:28,619"
you would not be here now to hate me.,"00:05:28,787 "," 00:05:31,414"
"If I am for the axe,then for mercy's sake,","00:05:31,623 "," 00:05:33,708"
just swing it.,"00:05:33,792 "," 00:05:36,293"
"It's not that I don't love our little talks,","00:05:36,837 "," 00:05:38,504"
it's just...,"00:05:38,672 "," 00:05:40,589"
I don't love them.,"00:05:41,675 "," 00:05:43,342"
"Frigga is the only reasonyou're still alive,","00:05:43,510 "," 00:05:45,678"
and you will never see her again.,"00:05:45,762 "," 00:05:47,179"
You will spend the rest of your daysin the dungeons.,"00:05:48,098 "," 00:05:52,393"
And what of Thor?,"00:05:55,522 "," 00:05:57,648"
You'll make that witless oaf kingwhile I rot in chains.,"00:05:58,275 "," 00:06:01,861"
Thor must strive to undothe damage you have done.,"00:06:02,029 "," 00:06:05,531"
He will bring order to the Nine Realms,"00:06:05,699 "," 00:06:07,199"
"and then, yes...","00:06:07,367 "," 00:06:09,326"
He will be king.,"00:06:10,245 "," 00:06:12,163"
Ah!,"00:06:21,882 "," 00:06:23,007"
I've got this completely under control!,"00:06:59,544 "," 00:07:01,253"
Is that why everything is on fire?,"00:07:01,421 "," 00:07:03,464"
Ah!,"00:07:18,438 "," 00:07:19,438"
You're welcome.,"00:07:27,489 "," 00:07:29,031"
Ha!,"00:07:31,701 "," 00:07:32,701"
All yours.,"00:07:50,720 "," 00:07:51,762"
Hello.,"00:08:14,369 "," 00:08:15,369"
I accept your surrender.,"00:08:18,748 "," 00:08:20,291"
Anyone else?,"00:08:33,180 "," 00:08:34,513"
Perhaps next timewe should start with the big one.,"00:08:42,397 "," 00:08:45,941"
Keep moving. Come on!,"00:08:46,985 "," 00:08:49,153"
Keep moving. Go ahead of me.Don't you turn around!,"00:09:00,624 "," 00:09:03,083"
Where do we go next?,"00:09:04,127 "," 00:09:05,878"
"Hogun, the peaceis nearly won across the Nine Realms.","00:09:06,046 "," 00:09:10,007"
"You should stay here. Be withyour people, where your heart is.","00:09:11,134 "," 00:09:13,677"
Asgard can wait.,"00:09:13,845 "," 00:09:15,429"
You have my thanks.,"00:09:16,848 "," 00:09:18,807"
As you have mine.,"00:09:19,601 "," 00:09:21,644"
"Heimdall, when you're ready.","00:09:25,857 "," 00:09:27,441"
Is Vanaheim secure?,"00:10:12,445 "," 00:10:14,363"
As are Nornheim and Ria.,"00:10:14,531 "," 00:10:15,990"
Though our work would have gonemore quickly with you at the fore.,"00:10:16,241 "," 00:10:18,492"
You must think I'm a piece of breadthat needs to be buttered so heavily.,"00:10:19,577 "," 00:10:23,872"
That was not my intent.,"00:10:24,249 "," 00:10:26,125"
"For the first timesince Bifrost was destroyed,","00:10:26,418 "," 00:10:28,627"
the Nine Realms are at peace.,"00:10:28,712 "," 00:10:30,504"
They're well reminded of our strength,"00:10:30,672 "," 00:10:33,090"
and you have earned their respectand my gratitude.,"00:10:33,258 "," 00:10:37,886"
Thank you.,"00:10:37,971 "," 00:10:39,096"
Nothing out of order,"00:10:39,973 "," 00:10:41,724"
except your confusedand distracted heart.,"00:10:41,975 "," 00:10:45,019"
"This isn't about Jane Foster, Father.","00:10:45,186 "," 00:10:47,438"
"Human lives are fleeting,they're nothing.","00:10:47,856 "," 00:10:49,148"
You'd be better servedby what lies in front of you.,"00:10:49,649 "," 00:10:51,567"
"I'm telling you this, not as the Allfather,","00:10:54,612 "," 00:10:56,030"
but as your father.,"00:10:56,114 "," 00:10:57,156"
You are ready.,"00:10:57,240 "," 00:10:58,240"
The time has comefor you to take the throne.,"00:10:58,575 "," 00:11:00,367"
Embrace and celebratewhat you've won.,"00:11:00,493 "," 00:11:02,244"
Join your warriors.,"00:11:02,829 "," 00:11:04,371"
"Eat and drink, revel in their celebration.","00:11:04,456 "," 00:11:06,915"
At least pretend to enjoy yourself.,"00:11:08,043 "," 00:11:10,377"
Another!,"00:11:55,215 "," 00:11:56,548"
There was a timewhen you would celebrate for weeks.,"00:12:12,857 "," 00:12:15,859"
I remember you celebratedthe Battle of Harokin,"00:12:17,195 "," 00:12:20,280"
so much that you nearlystarted the second.,"00:12:20,407 "," 00:12:22,658"
"Well, the first was so much fun.","00:12:23,326 "," 00:12:25,327"
Take a drink with me.,"00:12:31,793 "," 00:12:33,836"
"Surely, the Allfather could haveno further task for you tonight.","00:12:33,962 "," 00:12:37,005"
"No, this is one I set myself.","00:12:37,173 "," 00:12:39,007"
It does not go unnoticedthat you disappear each night.,"00:12:40,760 "," 00:12:44,054"
There are nine realms.,"00:12:44,431 "," 00:12:46,432"
The future king of Asgardmust focus on more than one.,"00:12:46,599 "," 00:12:49,560"
I thank you for your sword,"00:12:54,649 "," 00:12:56,400"
"and for your counsel, good Lady Sif.","00:12:56,484 "," 00:12:59,611"
Hi.,"00:13:20,091 "," 00:13:23,427"
"So, what's the story with you?","00:13:23,720 "," 00:13:24,887"
Why does there have to be a story?There's no story.,"00:13:25,597 "," 00:13:27,556"
You spent the firstten minutes of our date,"00:13:27,724 "," 00:13:29,975"
hiding behind a menuthat has three choices on it.,"00:13:30,059 "," 00:13:32,019"
"It's either chicken,vegetarian, or fish, Jane.","00:13:32,604 "," 00:13:34,521"
I think there's a story,"00:13:34,898 "," 00:13:36,732"
and I'm thinkingthe story involves a guy.,"00:13:36,900 "," 00:13:40,068"
It's complicated.,"00:13:40,737 "," 00:13:42,070"
Is he still around?,"00:13:42,238 "," 00:13:43,405"
"No, he...","00:13:43,615 "," 00:13:45,532"
Went away.,"00:13:46,034 "," 00:13:47,201"
I've been there.,"00:13:47,368 "," 00:13:48,744"
"The going away. It's hard, isn't it?","00:13:48,912 "," 00:13:50,954"
I was seeing a woman,"00:13:51,247 "," 00:13:52,456"
and she took a job in New York.,"00:13:52,749 "," 00:13:54,416"
"Eventually, the distance killed it.","00:13:55,084 "," 00:13:56,877"
And the factthat she kept sleeping with other dudes.,"00:13:57,086 "," 00:14:00,422"
" No! Oh, so many.","00:14:00,590 "," 00:14:02,174"
"Hi. Could we get some wine, please?","00:14:03,593 "," 00:14:06,345"
"Sure, I'd love some.","00:14:06,513 "," 00:14:07,554"
"Richard, this is Darcy.","00:14:07,680 "," 00:14:09,264"
What are you doing here?,"00:14:10,308 "," 00:14:11,767"
Oh. Hello.,"00:14:13,978 "," 00:14:14,978"
"So, I show up to workat the lab/your mom's house,","00:14:15,230 "," 00:14:18,815"
"fully expecting youto be moping around in your pajamas,","00:14:18,942 "," 00:14:22,653"
eating ice cream and obsessing about...,"00:14:22,779 "," 00:14:24,488"
You know who.,"00:14:24,656 "," 00:14:25,656"
Ah.,"00:14:25,823 "," 00:14:26,865"
But you're not.You're wearing lady clothes.,"00:14:26,991 "," 00:14:29,409"
"You even showered, didn't you?You smell good.","00:14:29,536 "," 00:14:31,119"
Is there a point to all this?,"00:14:31,246 "," 00:14:32,246"
Because there really needsto be a point to all this.,"00:14:32,330 "," 00:14:34,331"
Right.,"00:14:34,457 "," 00:14:35,666"
You know all that scientific equipmentyou don't look at anymore?,"00:14:36,209 "," 00:14:38,377"
You might wantto start looking at it again.,"00:14:39,295 "," 00:14:41,255"
This is the reasonwe came all the way out here.,"00:14:41,381 "," 00:14:43,423"
It's malfunctioning.,"00:14:43,550 "," 00:14:44,550"
That's what I said.,"00:14:44,634 "," 00:14:45,634"
That's what I did.,"00:14:47,178 "," 00:14:48,595"
I thought you would do somethinga little more scientific.,"00:14:48,680 "," 00:14:50,639"
" I'm sure it's nothing. Yeah, it's...","00:14:50,807 "," 00:14:52,349"
It doesn't look like nothing.,"00:14:52,433 "," 00:14:53,600"
It kind of looks like the readingsthat Erik was rambling about.,"00:14:53,726 "," 00:14:55,936"
Our friend Erik,"00:14:56,271 "," 00:14:57,354"
kind of went banana balls.,"00:14:57,981 "," 00:14:59,481"
He's not interested.,"00:14:59,607 "," 00:15:00,566"
 I'm not interested. I'm interested.,"00:15:00,650 "," 00:15:01,650"
It's time for you to go now.,"00:15:01,901 "," 00:15:03,318"
Okay.,"00:15:04,696 "," 00:15:05,779"
Short but sweet.,"00:15:08,992 "," 00:15:10,158"
She needs help.,"00:15:10,243 "," 00:15:11,952"
I think I'm going to have the sea bass.,"00:15:15,331 "," 00:15:17,165"
"Sea bass, yeah. Sea bass is good.","00:15:17,333 "," 00:15:19,209"
"Sea bass, sea bass, sea bass,sea bass, sea bass, sea bass.","00:15:20,253 "," 00:15:24,673"
Sea bass...,"00:15:24,841 "," 00:15:27,301"
Sea bass.,"00:15:28,595 "," 00:15:29,595"
Jane?,"00:15:29,679 "," 00:15:31,096"
Maybe you should stopsaying sea bass,"00:15:31,180 "," 00:15:32,764"
and go after your friend.,"00:15:32,849 "," 00:15:33,890"
This was so fun.,"00:15:34,892 "," 00:15:36,018"
I'll just stay hereand say sea bass alone.,"00:15:37,020 "," 00:15:38,937"
And I hate you.,"00:15:46,821 "," 00:15:47,821"
What? I said he was cute.,"00:15:48,615 "," 00:15:50,574"
Just shut up and drive.,"00:15:50,908 "," 00:15:52,701"
You need to take the next left.,"00:16:01,836 "," 00:16:02,836"
 Who's he? He's my intern.,"00:16:04,297 "," 00:16:06,048"
" You have an intern? Oh, yeah.","00:16:06,591 "," 00:16:08,383"
"Hello, Dr. Foster.","00:16:08,635 "," 00:16:10,510"
It's such a great honorto be working with you.,"00:16:10,637 "," 00:16:12,220"
Right. I have to call Erik.,"00:16:12,722 "," 00:16:14,848"
"Oh, take a right.","00:16:14,974 "," 00:16:16,308"
And a left.,"00:16:18,561 "," 00:16:19,645"
I have totally mastereddriving in London.,"00:16:21,731 "," 00:16:24,691"
"Hi, Erik. It's me again. Where are you?","00:16:24,817 "," 00:16:28,320"
"I came here because you said you wereonto something, and then you vanish.","00:16:28,446 "," 00:16:31,239"
I'm here at Stonehenge,"00:16:31,491 "," 00:16:32,908"
for what has been aninteresting unfolding of events today.,"00:16:33,076 "," 00:16:36,244"
The police were called to the scene,"00:16:36,579 "," 00:16:38,080"
shortly after 11 A.M. this morning,"00:16:38,164 "," 00:16:39,665"
after a seemingly harmless ramblerapproached the area,"00:16:39,749 "," 00:16:43,168"
"then, decided to strip nakedand effectively","00:16:43,252 "," 00:16:46,046"
terrorize tourists therewith scientific equipment,"00:16:46,172 "," 00:16:48,298"
whilst shoutingthat he was trying to save them.,"00:16:48,591 "," 00:16:51,301"
"The man, later identifiedas noted astrophysicist Dr. Erik Selvig","00:16:51,844 "," 00:16:55,681"
has been called infor questioning by police.,"00:16:55,765 "," 00:16:58,392"
"Come on, this is exciting.","00:17:00,645 "," 00:17:02,437"
Look! The intern is excited.,"00:17:03,106 "," 00:17:04,731"
Ian.,"00:17:04,941 "," 00:17:06,066"
Do you want the phase meter?,"00:17:06,192 "," 00:17:07,651"
 No. Bring the phase meter.,"00:17:07,735 "," 00:17:09,194"
The toasterlooking thing.,"00:17:10,113 "," 00:17:11,154"
Yeah. I know what the phase meter is.,"00:17:11,322 "," 00:17:13,865"
How do I change the ringtoneon this thing?,"00:17:21,541 "," 00:17:23,917"
An astrophysicist with three degrees,"00:17:24,001 "," 00:17:25,961"
should be ableto change her own ringtone.,"00:17:26,045 "," 00:17:27,796"
Why are you calling me?,"00:17:27,922 "," 00:17:29,381"
I didn't want to shout.Intern says it's this way.,"00:17:29,465 "," 00:17:31,717"
 Ian. My name is Ian. Shh.,"00:17:31,801 "," 00:17:33,844"
I am not getting stabbedin the name of science.,"00:17:47,358 "," 00:17:51,027"
"It's okay, we're Americans.","00:17:51,154 "," 00:17:52,654"
Is that supposed to make them like us?,"00:17:52,739 "," 00:17:54,698"
They'll make it go away.Shh.,"00:17:54,782 "," 00:17:56,533"
"Oh, they're kids.","00:17:58,870 "," 00:18:00,454"
Are you the police?,"00:18:00,788 "," 00:18:01,913"
"No, we're scientists. Well, I am.","00:18:02,540 "," 00:18:05,250"
Thanks.,"00:18:05,543 "," 00:18:06,626"
We just found it.,"00:18:06,753 "," 00:18:08,420"
Can you show us?,"00:18:10,631 "," 00:18:11,840"
That doesn't seem right.,"00:18:38,326 "," 00:18:40,827"
Where'd it go?,"00:18:57,720 "," 00:18:58,887"
That's...,"00:19:12,443 "," 00:19:13,443"
That's incredible!,"00:19:14,028 "," 00:19:15,111"
What happened?,"00:19:28,835 "," 00:19:30,252"
Sometimes they come back.,"00:19:30,419 "," 00:19:31,795"
Sometimes they don't.,"00:19:32,088 "," 00:19:33,505"
I want to throw something!,"00:19:36,259 "," 00:19:37,676"
"Jane, give me your shoe.","00:19:37,802 "," 00:19:38,927"
I haven't seen readings like this since...,"00:19:41,430 "," 00:19:43,723"
Since...,"00:19:44,350 "," 00:19:45,350"
New Mexico?,"00:19:45,476 "," 00:19:46,476"
Don't touch anything!,"00:19:51,023 "," 00:19:52,941"
Give me your shoe.,"00:19:55,695 "," 00:19:57,279"
Oh.,"00:20:02,910 "," 00:20:04,119"
Were those the car keys?,"00:20:18,342 "," 00:20:20,802"
Whoa. Ah!,"00:20:49,165 "," 00:20:50,665"
Oh!,"00:20:52,668 "," 00:20:54,169"
Darcy!,"00:20:58,507 "," 00:20:59,507"
Oh!,"00:21:46,722 "," 00:21:47,722"
The Aether awakens us.,"00:23:00,546 "," 00:23:02,797"
The Convergence returns.,"00:23:02,965 "," 00:23:06,426"
You're late.,"00:23:21,150 "," 00:23:22,817"
Merriment can sometimesbe a heavier burden than battle.,"00:23:23,903 "," 00:23:27,155"
Then you're doingone of them incorrectly.,"00:23:27,323 "," 00:23:28,823"
Perhaps.,"00:23:29,742 "," 00:23:31,659"
How fare the stars?,"00:23:31,827 "," 00:23:33,661"
Still shining.,"00:23:33,829 "," 00:23:35,497"
"From here, I can seenine realms and 10 trillion souls.","00:23:35,664 "," 00:23:38,458"
Do you recallwhat I taught you of the Convergence?,"00:23:43,339 "," 00:23:46,091"
Yes.,"00:23:46,258 "," 00:23:47,342"
The alignment of the worlds.,"00:23:47,593 "," 00:23:49,844"
"It approaches, doesn't it?","00:23:50,012 "," 00:23:51,721"
The universe hasn't seen this marvelsince before my watch began.,"00:23:51,972 "," 00:23:55,850"
Few can sense it. Even fewer can see it.,"00:23:56,894 "," 00:24:00,105"
"But while its effects can be dangerous,","00:24:01,524 "," 00:24:04,067"
it is truly beautiful.,"00:24:04,902 "," 00:24:07,737"
I see nothing.,"00:24:09,031 "," 00:24:10,490"
"Or, perhaps,that is not the beauty you seek.","00:24:10,574 "," 00:24:14,202"
How is she?,"00:24:20,042 "," 00:24:21,376"
"She's quite clever,your mortal.","00:24:21,544 "," 00:24:23,461"
"She doesn't know it yet,","00:24:23,587 "," 00:24:24,838"
but she studiesthe Convergence as well.,"00:24:24,922 "," 00:24:27,423"
Even...,"00:24:27,591 "," 00:24:28,800"
What?,"00:24:30,553 "," 00:24:31,970"
I can't see her.,"00:24:34,807 "," 00:24:36,224"
Jane!,"00:25:15,639 "," 00:25:18,224"
Where the hell were you?,"00:25:18,809 "," 00:25:20,101"
Tell me you didn't call the police.,"00:25:20,436 "," 00:25:21,853"
What was I supposed to do?,"00:25:21,937 "," 00:25:23,062"
 Not call the police. I was freaking out.,"00:25:23,189 "," 00:25:24,981"
"You call the cops, they call the Feds.","00:25:25,065 "," 00:25:26,274"
"Next thing you know,we have S.H.I.E.L.D. crawling all over","00:25:26,358 "," 00:25:28,276"
 Area 51ing the place. Jane.,"00:25:28,485 "," 00:25:29,944"
We had a stable gravitation anomaly.,"00:25:30,029 "," 00:25:32,113"
We had unimpeded access.,"00:25:32,198 "," 00:25:33,489"
Our only competition was 10 years old!,"00:25:33,824 "," 00:25:36,117"
Jane! You were gone for 5 hours.,"00:25:36,285 "," 00:25:37,827"
What?,"00:25:38,370 "," 00:25:39,621"
That's weird.,"00:25:46,462 "," 00:25:48,129"
Typical.,"00:26:09,693 "," 00:26:11,110"
Jane.,"00:26:11,862 "," 00:26:12,904"
Sorry. I just neededto make sure you were real.,"00:26:15,574 "," 00:26:18,326"
It's been a very strange day.,"00:26:18,494 "," 00:26:19,994"
"I am. Jane, what...","00:26:20,162 "," 00:26:21,663"
Where were you?,"00:26:22,081 "," 00:26:24,332"
Heimdall cannot see you.,"00:26:25,251 "," 00:26:26,584"
I was right here where you left me.,"00:26:26,752 "," 00:26:28,503"
"I was waiting, and then I was crying","00:26:28,754 "," 00:26:30,838"
and then I went out looking for you.,"00:26:30,965 "," 00:26:32,507"
You said you were coming back.,"00:26:32,675 "," 00:26:34,217"
"I know. I know,but the Bifrost was destroyed.","00:26:34,385 "," 00:26:36,719"
The Nine Realms erupted into chaos.,"00:26:36,887 "," 00:26:38,429"
"Wars were raging,marauders were pillaging.","00:26:38,555 "," 00:26:40,723"
I had to put an end to the slaughter.,"00:26:41,267 "," 00:26:42,892"
"As excuses go, it's not terrible.","00:26:44,478 "," 00:26:48,231"
But I saw you on TV.You were in New York!,"00:26:48,315 "," 00:26:51,150"
"Jane, I fought to protect youfrom the dangers of my world","00:26:52,069 "," 00:26:54,779"
but I was wrong.,"00:26:54,863 "," 00:26:56,656"
I was a fool.,"00:26:56,824 "," 00:26:58,700"
But I believethat fate brought us together.,"00:26:59,576 "," 00:27:03,037"
"Jane, I don't know where you were,or what happened, but I do know this...","00:27:05,124 "," 00:27:08,167"
What?,"00:27:09,003 "," 00:27:10,003"
I know...,"00:27:11,255 "," 00:27:12,297"
You do?,"00:27:13,507 "," 00:27:14,632"
Do what?,"00:27:16,135 "," 00:27:17,218"
What?,"00:27:17,845 "," 00:27:18,970"
Hey!,"00:27:19,555 "," 00:27:20,555"
Is this you?,"00:27:22,308 "," 00:27:23,766"
"Uh, we're kind ofin the middle of something here.","00:27:28,147 "," 00:27:29,564"
"Um, I'm pretty surewe are getting arrested.","00:27:29,982 "," 00:27:32,650"
Hold that thought.,"00:27:32,901 "," 00:27:33,901"
"Look at you,still all muscly and everything.","00:27:35,321 "," 00:27:38,906"
How's space?,"00:27:38,991 "," 00:27:40,658"
Space is fine.,"00:27:40,743 "," 00:27:42,869"
Excuse me.,"00:27:42,995 "," 00:27:44,245"
 Are you Jane Foster? Yes.,"00:27:44,413 "," 00:27:45,496"
Do you know this man?,"00:27:45,581 "," 00:27:46,581"
He's my intern.,"00:27:48,125 "," 00:27:49,250"
My intern's intern.,"00:27:50,419 "," 00:27:51,586"
"This is private propertyand you're trespassing, the lot of you.","00:27:51,712 "," 00:27:53,713"
You'll have to come with me.,"00:27:53,797 "," 00:27:55,089"
Jane.,"00:28:00,888 "," 00:28:01,888"
 Jane. Thor?,"00:28:02,681 "," 00:28:04,640"
Are you all right?,"00:28:04,975 "," 00:28:05,975"
What just happened?,"00:28:06,185 "," 00:28:07,352"
Place your handson your heads. Step back.,"00:28:07,936 "," 00:28:10,438"
This woman is unwell.,"00:28:10,522 "," 00:28:11,564"
She's dangerous.,"00:28:11,648 "," 00:28:12,648"
So am I.,"00:28:13,650 "," 00:28:14,984"
Requesting armed response officersto scene.,"00:28:15,986 "," 00:28:18,112"
 Hold on to me. What are you doing?,"00:28:18,489 "," 00:28:20,114"
Holy shit.,"00:28:28,457 "," 00:28:30,500"
We have to do that again.,"00:28:57,986 "," 00:29:00,029"
Hi.,"00:29:00,489 "," 00:29:01,489"
Welcome to Asgard.,"00:29:04,326 "," 00:29:06,494"
"Look upon my legacy, Algrim.","00:29:27,933 "," 00:29:30,518"
I can barely remember a timebefore the light.,"00:29:32,354 "," 00:29:34,730"
Our survival will be your legacy.,"00:29:35,482 "," 00:29:38,651"
The Asgardians will sufferas we have suffered.,"00:29:40,612 "," 00:29:44,282"
I will reclaim the Aether.,"00:29:44,366 "," 00:29:45,616"
I will restore our world.,"00:29:45,701 "," 00:29:46,951"
And I will put an endto this poisoned universe.,"00:29:47,035 "," 00:29:49,745"
What's that?,"00:29:58,046 "," 00:29:59,046"
Be still.,"00:29:59,131 "," 00:30:00,173"
This is not of Earth. What is it?,"00:30:07,723 "," 00:30:10,099"
We do not know.,"00:30:10,893 "," 00:30:12,560"
But she will not survive theamount of energy surging within her.,"00:30:13,270 "," 00:30:17,231"
"That's a quantum field generator,isn't it?","00:30:22,779 "," 00:30:24,405"
It's a soul forge.,"00:30:25,073 "," 00:30:26,908"
Does a soul forge transfer molecularenergy from one place to another?,"00:30:27,034 "," 00:30:30,244"
Yes.,"00:30:33,123 "," 00:30:34,165"
Quantum field generator.,"00:30:34,291 "," 00:30:36,042"
My words are mere noises to youthat you ignore them completely?,"00:30:37,169 "," 00:30:40,087"
She is ill.,"00:30:40,255 "," 00:30:41,380"
She is mortal.,"00:30:41,507 "," 00:30:43,758"
Illness is their defining trait.,"00:30:43,926 "," 00:30:45,468"
I brought her herebecause we can help her.,"00:30:45,594 "," 00:30:47,220"
She does not belong here in Asgard,"00:30:47,304 "," 00:30:49,222"
any more than a goatbelongs at a banquet table.,"00:30:49,389 "," 00:30:52,767"
Did he just...,"00:30:52,935 "," 00:30:54,519"
Who do you think you are?,"00:30:54,603 "," 00:30:56,187"
"I am Odin, King of Asgard.","00:30:56,271 "," 00:30:58,814"
Protector of the Nine Realms.,"00:30:58,982 "," 00:31:00,525"
"Oh. Well, I'm...","00:31:01,401 "," 00:31:03,277"
"I know very well who you are,Jane Foster.","00:31:03,445 "," 00:31:06,280"
You told your dad about me?,"00:31:07,241 "," 00:31:08,616"
"Something is within her, Father.","00:31:09,493 "," 00:31:10,952"
Something I have not seen before.,"00:31:11,078 "," 00:31:12,245"
Her world has its healers.,"00:31:12,412 "," 00:31:13,621"
They are called doctors.Let them deal with it.,"00:31:13,747 "," 00:31:15,623"
"Guards, take her back to Midgard.","00:31:15,791 "," 00:31:17,583"
"No, I would not...","00:31:18,961 "," 00:31:20,461"
...touch her.,"00:31:22,297 "," 00:31:23,381"
"Jane, are you all right?","00:31:23,507 "," 00:31:24,799"
Yeah.,"00:31:25,342 "," 00:31:26,467"
It's impossible.,"00:31:30,180 "," 00:31:31,430"
The infection... It's defending her.,"00:31:32,641 "," 00:31:35,393"
No.,"00:31:36,019 "," 00:31:37,311"
It's defending itself.,"00:31:37,813 "," 00:31:39,480"
Come with me.,"00:31:40,524 "," 00:31:42,525"
There are relicsthat predate the universe itself.,"00:31:42,651 "," 00:31:46,445"
What lies within herappears to be one of them.,"00:31:46,613 "," 00:31:50,491"
The Nine Realms are not eternal.,"00:31:51,493 "," 00:31:53,995"
They had a dawn,"00:31:54,162 "," 00:31:55,329"
as they will have a dusk.,"00:31:55,497 "," 00:31:56,664"
But before that dawn,"00:31:58,000 "," 00:31:59,000"
"the dark forces, the Dark Elves,reigned absolute and unchallenged.","00:31:59,167 "," 00:32:05,506"
Born of eternal night,"00:32:07,467 "," 00:32:08,759"
the Dark Elves cometo steal away the light.,"00:32:08,885 "," 00:32:11,721"
I know these stories.Mother told them to us as children.,"00:32:12,180 "," 00:32:15,600"
Their leader Malekith made a weaponout of that darkness,"00:32:15,684 "," 00:32:18,936"
and it was called the Aether.,"00:32:19,021 "," 00:32:20,605"
While the other relicsoften appear as stones,"00:32:20,689 "," 00:32:23,733"
the Aether is fluid and everchanging.,"00:32:23,817 "," 00:32:26,485"
It changes matter into dark matter.,"00:32:26,653 "," 00:32:29,238"
"It seeks out host bodies,drawing strength from their lifeforce.","00:32:29,364 "," 00:32:32,950"
Malekith sought to usethe Aether's power,"00:32:34,202 "," 00:32:37,163"
to return the universeto one of darkness.,"00:32:37,331 "," 00:32:41,083"
"But, after eternities of bloodshed","00:32:41,752 "," 00:32:44,378"
my father Bor finally triumphed,"00:32:44,463 "," 00:32:47,048"
ushering in a peacethat lasted thousands of years.,"00:32:47,215 "," 00:32:51,719"
